{
  "id": "patch-003",
  "requirementId": "req-001",
  "sourceChatMessageId": "msg-1775572707710-user",
  "target": {
    "artifactType": "ui"
  },
  "summary": "聊天回写 UI Draft",
  "generator": "rule_engine",
  "generatedAt": "2026-04-07T14:38:27.711Z",
  "operations": [
    {
      "op": "replace",
      "path": "/visualThesis",
      "value": "把产品工作台做成带有编辑室气质的决策界面，温和但不平淡，强调产物流转与上下文集中感。 本轮补充：3232323 本轮补充：31313 本轮补充：31313",
      "reason": "把当前聊天里的视觉方向直接回写到 UI 设计命题。"
    },
    {
      "op": "replace",
      "path": "/interactionThesis/0",
      "value": "31313",
      "reason": "更新当前 UI 的首要交互原则。"
    },
    {
      "op": "replace",
      "path": "/designStyle/tone",
      "value": "31313",
      "reason": "同步 UI 整体语气和风格走向。"
    }
  ]
}
